이름,날짜,생성일
"NEO Dr. INC. to Showcase High-Elasticity, High-Polymer PDO Sutures ‘JAMBER’ at KIMES 2025",2025년 2월 11일,2025년 4월 29일 오전 10:46
NEO Dr. INC. Unveils New PDO Lifting Thread ‘N-JAMBER’ at ‘AMWC JAPAN’,2025년 2월 3일,2025년 4월 29일 오전 10:50
NEO Dr. INC. Launches World’s First Spring-Structured PDO Elastic Thread ‘N-JAMBER’ in Japan,2025년 1월 25일,2025년 4월 29일 오전 10:51
NEO Dr. INC. Launches PDO Elastic Thread ‘JAMBER NCL’,2025년 1월 15일,2025년 4월 29일 오전 10:52
NEO Dr. INC. Launches PDO Elastic Thread ‘JAMBER NCL’ to Maximize Volume Enhancement,2025년 1월 15일,2025년 4월 29일 오전 10:53
NEO Dr. INC. Wins ‘Excellence in Technology Award’ for PDO Lifting Materials,2024년 4월 8일,2025년 4월 29일 오전 10:55